source,time,headline,content
Reuters,7 minutes ago,"Stolen data of 600,000 Indians sold on bot markets so far - study","Around five million people globally have had their data stolen and sold on the bot market till date, of which 600,000 are from India, making it the worst affected country, according to one of the world's largest VPN serice providers NordVPN.  Bot markets are used by hackers to sell stolen data from victims' devices with bot malware.  The study by NordVPN, of Lithuania's Nord Security, said the stolen data included user logins, cookies, digital fingerprints, screenshots and other information, with the average price for the digital identity of a person pegged at 490 Indian rupees($5.95)."
Barrons.com,7 minutes ago,Wells Fargo Stock Is Primed to Jump Higher. How to Play It.,"Wells Fargo’s broad ownership among hedge funds and mutual funds is an intriguing revelation, suggesting that January’s earnings report could act as a spring-loaded event."
Bloomberg,14 minutes ago,Hong Kong Stocks Rally on Report City May Relax Covid Rules,"(Bloomberg) -- Hong Kong stocks jumped following a report that the government may further loosen Covid-related restrictions, with shares related to the economy’s reopening surging. Most Read from BloombergPutin Calls Russian Nukes Deterrent Factor, Says War Risk RisingPeru’s President Accused of Coup After Move to Dissolve CongressWhy Did So Many US Men Quit Working? Social Status May Hold the Key, Study SaysBe Careful, Here Come the Predictions for 2023Musk Spars With San Francisco Over Probe o"
Bloomberg,1 hour ago,"Stocks Mixed on China Reopening, Recession Fears: Markets Wrap","(Bloomberg) -- Stocks in Asia fluctuated following signs China would further relax its Covid restrictions, while Treasuries flashed warning signs of recession. The dollar strengthened in an indication of demand for havens.Most Read from BloombergPutin Calls Russian Nukes Deterrent Factor, Says War Risk RisingPeru’s President Accused of Coup After Move to Dissolve CongressWhy Did So Many US Men Quit Working? Social Status May Hold the Key, Study SaysBe Careful, Here Come the Predictions for 2023M"
Investor's Business Daily,3 hours ago,Why This Market Rally Is So Dangerous; Tesla Nears Bear Lows On This Move,"The market rally is holding key levels, but the choppy action is dangerous. Tesla stock fell toward bear market lows amid new China discounts."
Reuters,4 hours ago,"China, Hong Kong stocks lift Asian equities; growth worries loom","Asian equities rose on Thursday, propped up by Hong Kong and China stocks amid growing optimism over an easing of COVID restrictions in the world's second biggest economy even as fears of a slowdown and worries over Fed interest rate rises linger.  MSCI's broadest index of Asia-Pacific shares outside Japan was up 0.57%, on track to snap a two-day losing streak.  China's stock market was 0.14% higher, with Hong Kong's Hang Seng Index surging nearly 3% after a pro-China newspaper reported that Hong Kong government is considering relaxing its COVID-19 curbs further."
Zacks,5 hours ago,Are Options Traders Betting on a Big Move in Peabody (BTU) Stock?,Investors need to pay close attention to Peabody (BTU) stock based on the movements in the options market lately.
Reuters,5 hours ago,FTX founder Sam Bankman-Fried is said to face market manipulation inquiry by U.S. prosecutors - NYT,"The prosecutors are looking into whether Bankman-Fried controlled the prices of two interlinked currencies, TerraUsd and Luna, to benefit the entities he controlled including FTX and Alameda Research, the report said.  The investigation is in its early stages, the newspaper said, adding that it is not clear whether prosecutors have determined any wrongdoing by Bankman-Fried, or when they began looking at the TerraUSD and Luna trades."
Fox Business,6 hours ago,Billionaire Ray Dalio warns stock market hasn't priced in 'very harmful' Fed rate hikes,"Bridgewater Associates founder Ray Dalio said the stock market could face further turmoil in the coming months as the Fed hikes interest rates to a ""harmful"" level."
Bloomberg,7 hours ago,Emerging-Market Debt Is Sliding Into Distress. Just Look at Ghana,"(Bloomberg) -- A few blocks from Ghana’s statehouse in Accra sits a 14.5 acre parcel of prime real estate with a football field-sized hole in the middle of it. What should be emerging from the ground is the frame and sweeping, concave roof of the futuristic 5,000-seat National Cathedral of Ghana. Instead the project has stalled, a victim of an economic crisis in the West African country, which was until recently one of the world’s fastest-growing economies and a magnet for foreign investment.Mos"
Zacks,7 hours ago,Bucking the Trend: 3 Stocks Showing Stellar Relative Strength this Week,Market pullbacks can offer a treasure trove of ideas in the form of relative strength.
TipRanks,7 hours ago,‘Defense Is the Name of the Game’: Jefferies Suggests 2 High-Yield Dividend Stocks — Including One With 13% Yield,"The rollercoaster ride continues in the stock market, and equities have been falling across the board this week. The S&P 500 is down 3.5%, and the Dow has lost some 870 points. The market drop was fueled by uncertainty; recent economic data has been unexpectedly positive, and it’s clouded the forecast for the Fed’s interest rate decision next week. The central bank’s twin mandates, to rein in inflation and to moderate unemployment, frequently run counter to each other, and with inflation running"
Yahoo Finance,7 hours ago,"After hours stock movers: GameStop, Rent the Runway, C3.ai, and more","Top stocks moving after hours on Wednesday, December 7, 2023."
Zacks,7 hours ago,Core & Main (CNM) Dips More Than Broader Markets: What You Should Know,"Core & Main (CNM) closed at $20.68 in the latest trading session, marking a -0.62% move from the prior day."
Zacks,7 hours ago,Doctor Reddy's (RDY) Gains As Market Dips: What You Should Know,"In the latest trading session, Doctor Reddy's (RDY) closed at $53.25, marking a +0.02% move from the previous day."
Zacks,7 hours ago,Prologis (PLD) Gains As Market Dips: What You Should Know,"Prologis (PLD) closed at $116 in the latest trading session, marking a +1.22% move from the prior day."
Zacks,7 hours ago,Accenture (ACN) Gains As Market Dips: What You Should Know,"Accenture (ACN) closed the most recent trading day at $286.69, moving +0.45% from the previous trading session."
Zacks,7 hours ago,Constellation Brands (STZ) Dips More Than Broader Markets: What You Should Know,"Constellation Brands (STZ) closed at $246.66 in the latest trading session, marking a -0.39% move from the prior day."
Zacks,7 hours ago,CSX (CSX) Dips More Than Broader Markets: What You Should Know,"In the latest trading session, CSX (CSX) closed at $30.91, marking a -0.8% move from the previous day."
Zacks,7 hours ago,The Charles Schwab Corporation (SCHW) Dips More Than Broader Markets: What You Should Know,"The Charles Schwab Corporation (SCHW) closed the most recent trading day at $80.19, moving -0.5% from the previous trading session."
Zacks,7 hours ago,U.S. Bancorp (USB) Gains As Market Dips: What You Should Know,"U.S. Bancorp (USB) closed at $43.56 in the latest trading session, marking a +1.44% move from the prior day."
Zacks,7 hours ago,"Alliance Resource Partners, L.P. (ARLP) Gains As Market Dips: What You Should Know","Alliance Resource Partners, L.P. (ARLP) closed the most recent trading day at $21.74, moving +0.6% from the previous trading session."
Barrons.com,7 hours ago,Carvana Stock Plunges as Fear of Debt Restructuring Grows,Wedbush analyst Seth Basham downgraded his rating on Carvana shares to Underperform and lowered his price target for the company’s stock to $1.
Zacks,8 hours ago,Time to Buy These 3 Food Stocks for 2023,These Food-Miscellaneous stocks may continue to add valuable protection against inflation going into 2023. All of these companies look poised for growth in what is expected to be another challenging year for the broader economy.
Zacks,8 hours ago,United Rentals (URI) Gains As Market Dips: What You Should Know,"United Rentals (URI) closed at $351.52 in the latest trading session, marking a +1.22% move from the prior day."
Zacks,8 hours ago,Coupa Software (COUP) Gains As Market Dips: What You Should Know,"Coupa Software (COUP) closed the most recent trading day at $61.25, moving +0.16% from the previous trading session."
Zacks,8 hours ago,General Dynamics (GD) Dips More Than Broader Markets: What You Should Know,"General Dynamics (GD) closed the most recent trading day at $246.21, moving -0.83% from the previous trading session."
Zacks,8 hours ago,Crown Castle (CCI) Gains As Market Dips: What You Should Know,"Crown Castle (CCI) closed the most recent trading day at $138.72, moving +1.06% from the previous trading session."
Zacks,8 hours ago,Union Pacific (UNP) Gains As Market Dips: What You Should Know,"Union Pacific (UNP) closed at $212.22 in the latest trading session, marking a +0.51% move from the prior day."
Zacks,8 hours ago,"Intuitive Surgical, Inc. (ISRG) Gains As Market Dips: What You Should Know","Intuitive Surgical, Inc. (ISRG) closed the most recent trading day at $267.96, moving +0.62% from the previous trading session."
Zacks,8 hours ago,FedEx (FDX) Dips More Than Broader Markets: What You Should Know,"FedEx (FDX) closed at $172.28 in the latest trading session, marking a -0.44% move from the prior day."
Zacks,8 hours ago,Morgan Stanley (MS) Dips More Than Broader Markets: What You Should Know,"Morgan Stanley (MS) closed at $87.28 in the latest trading session, marking a -0.26% move from the prior day."
Zacks,8 hours ago,Covenant Logistics (CVLG) Dips More Than Broader Markets: What You Should Know,"In the latest trading session, Covenant Logistics (CVLG) closed at $37.87, marking a -0.37% move from the previous day."
Zacks,8 hours ago,Celestica (CLS) Gains As Market Dips: What You Should Know,"Celestica (CLS) closed the most recent trading day at $10.80, moving +0.28% from the previous trading session."
Zacks,8 hours ago,Lamb Weston (LW) Gains As Market Dips: What You Should Know,"In the latest trading session, Lamb Weston (LW) closed at $87.07, marking a +0.9% move from the previous day."
Zacks,8 hours ago,Plexus (PLXS) Gains As Market Dips: What You Should Know,"Plexus (PLXS) closed at $107.13 in the latest trading session, marking a +0.12% move from the prior day."
Zacks,8 hours ago,Texas Instruments (TXN) Dips More Than Broader Markets: What You Should Know,"Texas Instruments (TXN) closed the most recent trading day at $173.75, moving -0.34% from the previous trading session."
Zacks,8 hours ago,Flex (FLEX) Gains As Market Dips: What You Should Know,"Flex (FLEX) closed the most recent trading day at $21.56, moving +1.84% from the previous trading session."
Zacks,8 hours ago,Goldman Sachs (GS) Dips More Than Broader Markets: What You Should Know,"Goldman Sachs (GS) closed the most recent trading day at $359.92, moving -0.82% from the previous trading session."
Zacks,8 hours ago,American Express (AXP) Gains As Market Dips: What You Should Know,"In the latest trading session, American Express (AXP) closed at $154.77, marking a +0.05% move from the previous day."
Zacks,8 hours ago,Lam Research (LRCX) Gains As Market Dips: What You Should Know,"Lam Research (LRCX) closed at $444.28 in the latest trading session, marking a +0.27% move from the prior day."
Zacks,8 hours ago,Freeport-McMoRan (FCX) Gains As Market Dips: What You Should Know,"Freeport-McMoRan (FCX) closed at $38.55 in the latest trading session, marking a +0.23% move from the prior day."
Zacks,8 hours ago,Abbott (ABT) Gains As Market Dips: What You Should Know,"Abbott (ABT) closed the most recent trading day at $104.81, moving +0.91% from the previous trading session."
Zacks,8 hours ago,Commercial Metals (CMC) Dips More Than Broader Markets: What You Should Know,"In the latest trading session, Commercial Metals (CMC) closed at $49.27, marking a -0.94% move from the previous day."
Zacks,8 hours ago,Netflix (NFLX) Gains As Market Dips: What You Should Know,"Netflix (NFLX) closed at $308.42 in the latest trading session, marking a +0.94% move from the prior day."
Zacks,8 hours ago,Kinder Morgan (KMI) Dips More Than Broader Markets: What You Should Know,"Kinder Morgan (KMI) closed the most recent trading day at $18.04, moving -0.33% from the previous trading session."
